{
  "$schema": "https://json-schema.org/draft/2020-12/schema",
  "$id": "https://w3id.org/seqmake/parts/schema/part.schema.json",
  "title": "DNA parts catalog -- canonical part record",
  "description": "The canonical, authored representation of one part. The .gb file is generated from this by tools/build_gb.py; prose lives in the sibling <slug>.md.",
  "type": "object",
  "required": ["schema_version", "slug", "locus", "id", "description",
               "molecule_type", "sequence", "features"],
  "additionalProperties": false,
  "properties": {
    "schema_version": {"type": "string"},
    "slug": {"type": "string", "minLength": 1},
    "locus": {"type": "string", "description": "GenBank LOCUS identifier (<=16 chars)"},
    "id": {"type": "string"},
    "description": {"type": "string", "description": "GenBank DEFINITION line"},
    "molecule_type": {"type": "string", "enum": ["DNA", "RNA", "protein"]},
    "locus_annotations": {
      "type": "object",
      "description": "LOCUS-line annotations carried for a faithful .gb (topology, division, date).",
      "additionalProperties": {"type": "string"}
    },
    "sequence": {"type": "string", "minLength": 1},
    "references": {
      "type": "array",
      "items": {
        "type": "object",
        "additionalProperties": false,
        "properties": {
          "authors": {"type": "string"},
          "title": {"type": "string"},
          "journal": {"type": "string"},
          "pubmed_id": {"type": "string"},
          "medline_id": {"type": "string"},
          "consrtm": {"type": "string"},
          "comment": {"type": "string", "description": "carries the DOI as 'doi:<id>'"}
        }
      }
    },
    "features": {
      "type": "array",
      "minItems": 1,
      "description": "GenBank features in file order; the first parent-less feature is the main part.",
      "items": {
        "type": "object",
        "required": ["type", "start", "end", "strand", "qualifiers"],
        "additionalProperties": false,
        "properties": {
          "type": {
            "type": "string",
            "description": "GenBank/INSDC feature key (the shared vocabulary with the seqmake app), plus the de-facto synbio extension protein_domain. The Sequence Ontology accession is a derived /db_xref, mapped from this key by tools/so_terms.py. Deprecated INSDC signal keys (-35_signal/-10_signal) are expressed as regulatory + /regulatory_class; the display-only 'resistance' pseudo-type is not a feature key.",
            "enum": ["CDS", "gene", "promoter", "terminator", "RBS", "regulatory",
                     "protein_bind", "misc_binding", "rep_origin", "oriT",
                     "misc_recomb", "stem_loop", "sig_peptide", "mat_peptide",
                     "primer_bind", "misc_RNA", "misc_feature", "protein_domain"]
          },
          "start": {"type": "integer", "minimum": 0, "description": "0-based inclusive start"},
          "end": {"type": "integer", "minimum": 1, "description": "0-based exclusive end"},
          "strand": {"type": "integer", "enum": [1, -1]},
          "qualifiers": {
            "type": "object",
            "additionalProperties": {"type": "array", "items": {"type": "string"}}
          }
        }
      }
    },
    "review_status": {
      "type": "string",
      "description": "Trust level of this record's content as it self-corrects over time.",
      "enum": ["ai-generated", "ai-cross-checked", "expert-reviewed"]
    },
    "provenance": {
      "type": "object",
      "description": "How this record was produced (free-form; e.g. migrated_from, asserting agent/model).",
      "additionalProperties": true
    },
    "functional_claims": {
      "type": "array",
      "description": "Prose-derived functional knowledge (inducer, dynamic range, host range, ...). Each claim is self-describing: its source, extraction provenance, confidence, and review_status travel with it so the knowledge base can self-correct (a nanopublication shape, kept mutable in git).",
      "items": {
        "type": "object",
        "required": ["id", "type", "label", "source", "provenance",
                     "confidence", "review_status"],
        "additionalProperties": false,
        "properties": {
          "id": {"type": "string", "description": "stable id unique within the part"},
          "type": {"type": "string", "description": "claim kind, e.g. inducer / repression_dynamic_range / induction_dynamic_range / strength_class / host_range / mechanism"},
          "label": {"type": "string", "description": "human-readable statement of the claim"},
          "value": {"type": "object", "additionalProperties": true,
                    "description": "structured value (e.g. {fold: 80, unit: 'fold'} or {inducer: '...'})"},
          "ontology": {
            "type": "object",
            "description": "verified ontology mappings (ChEBI/OM/NCBI-taxon); a key may be null when not yet mapped (no guessed IRIs).",
            "additionalProperties": {"type": ["string", "null"]}
          },
          "source": {
            "type": "object",
            "additionalProperties": false,
            "description": "the literature the claim is drawn from, as granular as possible: prefer a verbatim quote and/or a figure/table/page locator over a bare PMID.",
            "properties": {
              "pmid": {"type": "string"},
              "doi": {"type": "string"},
              "url": {"type": "string"},
              "quote": {"type": "string", "description": "verbatim supporting text"},
              "quote_source": {"type": "string", "description": "where the quote was taken from: 'primary' (the paper) or 'catalog-doc' (the curated .md)"},
              "figure": {"type": "string", "description": "e.g. 'Fig 2', 'Fig 3B'"},
              "table": {"type": "string"},
              "page": {"type": "string"},
              "section": {"type": "string"}
            }
          },
          "provenance": {
            "type": "object",
            "additionalProperties": true,
            "description": "how the claim was produced: method, asserting agent/model, source doc, timestamp"
          },
          "confidence": {"type": "string", "enum": ["low", "medium", "high"]},
          "review_status": {"type": "string",
            "enum": ["ai-generated", "ai-cross-checked", "expert-reviewed"]},
          "supersedes": {"type": ["string", "null"],
            "description": "id of a prior claim this one corrects"}
        }
      }
    },
    "variant_rationale": {
      "type": "string",
      "description": "Why this protein is INTENTIONALLY a variant of its UniProt accession (e.g. dCas9 = catalytically-dead SpCas9 D10A/H840A). When set, the UniProt importer KEEPS the part's variant sequence; when absent, an incidental close variant (a few SNPs) is normalized to UniProt's canonical sequence."
    },
    "uniprot_features": {
      "type": "array",
      "description": "Protein features imported from UniProt (domains, active/binding sites, signal peptides) -- a cached projection of the authoritative source, NOT hand-authored. Coordinates are 0-based, end-exclusive, in residue space. Regenerate with tools/import_uniprot_features.py; baked into the generated .gb so GenBank consumers get them.",
      "items": {
        "type": "object",
        "required": ["type", "start", "end", "label"],
        "additionalProperties": false,
        "properties": {
          "type": {"type": "string", "description": "GenBank feature type (protein_domain, sig_peptide, binding, misc_feature, ...)"},
          "start": {"type": "integer", "minimum": 0},
          "end": {"type": "integer", "minimum": 1},
          "label": {"type": "string"},
          "so_term": {"type": ["string", "null"]},
          "description": {"type": "string"},
          "uniprot_type": {"type": "string", "description": "the original UniProt feature type"}
        }
      }
    },
    "uniprot_import": {
      "type": "object",
      "description": "provenance of the uniprot_features cache (accession, UniProt release, fetch date, sequence-match status).",
      "additionalProperties": true
    }
  }
}
