{
  "schema_version": "1.0",
  "slug": "AlkS",
  "locus": "AlkS",
  "id": "AlkS",
  "description": "AlkS",
  "molecule_type": "protein",
  "locus_annotations": {
    "data_file_division": "UNK",
    "date": "01-JAN-1980"
  },
  "sequence": "MGMKIKIINNDFPVAKIGLDRITTLVSAKVHNCIYRPRLSIADGTAPRVCLYRAPPGYGKTVALAFEWLRHRTTGRPAVWISLRASSYSEFDICAEIIEQLEAFELVTFSHVREGVSKPTLLRDLASSLWQSTSSNEIETLICLDNINQGLGLPLLHALMEFMLETPKSIRFAVAGNTIKGFSRLKLAGAMQEHTEKDLAFSADEAVALVEAEAVLGVSEVQIEALVQEMEGWPVLIGFLLKCELPAKSISTVVEIDNYFNDEIFEALPERYRVFLVNSSLLDVVTPDGYNYVFKCVNAASCIKYLSTNYMLLRHVEGEPAQFTLHPVLRDFLQGIAWAENPAKRSYLLKRAAFWHWRRGEYQYAIRIALRANDCRWAVGMSEGIILDLSFRQGEIDTLRHWLSELPVKDLHKNPIVLICFAWVLYFSQQSARAEKLLKDLITPPDKKNKWQEKGWPQLVFAIGKATNDEMLLSEELCNKWISLFGDSNAVGKGAALTCLAFIFASEYRFAELEKVLAQAQAVNKFAKQDFAFGWLYVAKLQQALASGKMSWARQLITQARTDSGAQIMETAFTSKMLDALELESNYELCRLDTSEEKFSEILEFIANHGVTDVFFSVCRVVSAWRLGRNDLNGSIEILEWAKAYAAEKNLPRLEVMSQIEIYQRLLFQGVTYINTLQAFEDRKIFSGPHSAPLKARLLLVQSLALSRDQNFHLAAHRALLAIQQARKISAGQLEVRGLLYLAGAQAGGGTLKKAQHNIAYALEMAKQLQCFQTVLDEIRLIKRLIPTSCEVFAAVNLDQAIGAFSLPQMVEIRKSAENKAGDFLTLKQVSVLKLVKEGCSNKQIATKMYVTEDAIKWHMRKIFTILNVKSRTQAIIEAERQGVI",
  "references": [],
  "features": [
    {
      "type": "CDS",
      "start": 0,
      "end": 885,
      "strand": 1,
      "qualifiers": {
        "label": [
          "AlkS"
        ],
        "synonym": [
          "AlkS",
          "alkS",
          "alkane-responsive regulator",
          "alkS crc-mut"
        ]
      }
    }
  ],
  "provenance": {
    "migrated_from": "genbank"
  },
  "functional_claims": []
}
