{
  "schema_version": "1.0",
  "slug": "Pcat",
  "locus": "Pcat",
  "id": "Pcat",
  "description": "Pcat",
  "molecule_type": "DNA",
  "locus_annotations": {
    "data_file_division": "UNK",
    "date": "01-JAN-1980"
  },
  "sequence": "TGATCGGCACGTAAGAGGTTCCAACTTTCACCATAATGAAATAAGATCACTACCGGGCGTATTTTTTGAGTTATCGAGATTTTCAGGAGCTAAGGAAGCTAAA",
  "references": [],
  "features": [
    {
      "type": "promoter",
      "start": 0,
      "end": 103,
      "strand": 1,
      "qualifiers": {
        "label": [
          "Pcat"
        ],
        "synonym": [
          "Pcat",
          "cat promoter"
        ]
      }
    }
  ],
  "review_status": "ai-generated",
  "provenance": {
    "migrated_from": "genbank"
  },
  "functional_claims": []
}
