{
  "schema_version": "1.0",
  "slug": "hPGK",
  "locus": "hPGK",
  "id": "hPGK",
  "description": "hPGK.",
  "molecule_type": "DNA",
  "locus_annotations": {
    "topology": "linear",
    "data_file_division": "UNK",
    "date": "01-JAN-1980"
  },
  "sequence": "GGGGTTGGGGTTGCGCCTTTTCCAAGGCAGCCCTGGGTTTGCGCAGGGACGCGGCTGCTCTGGGCGTGGTTCCGGGAAACGCAGCGGCGCCGACCCTGGGTCTCGCACATTCTTCACGTCCGTTCGCAGCGTCACCCGGATCTTCGCCGCTACCCTTGTGGGCCCCCCGGCGACGCTTCCTGCTCCGCCCCTAAGTCGGGAAGGTTCCTTGCGGTTCGCGGCGTGCCGGACGTGACAAACGGAAGCCGCACGTCTCACTAGTACCCTCGCAGACGGACAGCGCCAGGGAGCAATGGCAGCGCGCCGACCGCGATGGGCTGTGGCCAATAGCGGCTGCTCAGCAGGGCGCGCCGAGAGCAGCGGCCGGGAAGGGGCGGTGCGGGAGGCGGGGTGTGGGGCGGTAGTGTGGGCCCTGTTCCTGCCCGCGCGGTGTTCCGCATTCTGCAAGCCTCCGGAGCGCACGTCGGCAGTCGGCTCCCTCGTTGACCGAATCACCGACCTCTCTCCCCAG",
  "references": [],
  "features": [
    {
      "type": "promoter",
      "start": 0,
      "end": 511,
      "strand": 1,
      "qualifiers": {
        "label": [
          "hPGK"
        ],
        "synonym": [
          "PGK",
          "PGK promoter",
          "hPGK promoter",
          "PGK1 promoter",
          "human phosphoglycerate kinase 1 promoter"
        ],
        "note": [
          "Human phosphoglycerate kinase 1 (PGK1) promoter, medium-strength constitutive mammalian promoter. Extracted from a PGK lentiviral vector (Addgene 253233), hPGK promoter feature (511 bp)."
        ]
      }
    }
  ],
  "provenance": {
    "migrated_from": "genbank"
  },
  "functional_claims": []
}
