{
  "schema_version": "1.0",
  "slug": "cas9",
  "locus": "cas9",
  "id": "cas9",
  "description": "cas9",
  "molecule_type": "protein",
  "locus_annotations": {
    "data_file_division": "UNK",
    "date": "01-JAN-1980"
  },
  "sequence": "MDKKYSIGLDIGTNSVGWAVITDEYKVPSKKFKVLGNTDRHSIKKNLIGALLFDSGETAEATRLKRTARRRYTRRKNRICYLQEIFSNEMAKVDDSFFHRLEESFLVEEDKKHERHPIFGNIVDEVAYHEKYPTIYHLRKKLVDSTDKADLRLIYLALAHMIKFRGHFLIEGDLNPDNSDVDKLFIQLVQTYNQLFEENPINASGVDAKAILSARLSKSRRLENLIAQLPGEKKNGLFGNLIALSLGLTPNFKSNFDLAEDAKLQLSKDTYDDDLDNLLAQIGDQYADLFLAAKNLSDAILLSDILRVNTEITKAPLSASMIKRYDEHHQDLTLLKALVRQQLPEKYKEIFFDQSKNGYAGYIDGGASQEEFYKFIKPILEKMDGTEELLVKLNREDLLRKQRTFDNGSIPHQIHLGELHAILRRQEDFYPFLKDNREKIEKILTFRIPYYVGPLARGNSRFAWMTRKSEETITPWNFEEVVDKGASAQSFIERMTNFDKNLPNEKVLPKHSLLYEYFTVYNELTKVKYVTEGMRKPAFLSGEQKKAIVDLLFKTNRKVTVKQLKEDYFKKIECFDSVEISGVEDRFNASLGTYHDLLKIIKDKDFLDNEENEDILEDIVLTLTLFEDREMIEERLKTYAHLFDDKVMKQLKRRRYTGWGRLSRKLINGIRDKQSGKTILDFLKSDGFANRNFMQLIHDDSLTFKEDIQKAQVSGQGDSLHEHIANLAGSPAIKKGILQTVKVVDELVKVMGRHKPENIVIEMARENQTTQKGQKNSRERMKRIEEGIKELGSQILKEHPVENTQLQNEKLYLYYLQNGRDMYVDQELDINRLSDYDVDHIVPQSFLKDDSIDNKVLTRSDKNRGKSDNVPSEEVVKKMKNYWRQLLNAKLITQRKFDNLTKAERGGLSELDKAGFIKRQLVETRQITKHVAQILDSRMNTKYDENDKLIREVKVITLKSKLVSDFRKDFQFYKVREINNYHHAHDAYLNAVVGTALIKKYPKLESEFVYGDYKVYDVRKMIAKSEQEIGKATAKYFFYSNIMNFFKTEITLANGEIRKRPLIETNGETGEIVWDKGRDFATVRKVLSMPQVNIVKKTEVQTGGFSKESILPKRNSDKLIARKKDWDPKKYGGFDSPTVAYSVLVVAKVEKGKSKKLKSVKELLGITIMERSSFEKNPIDFLEAKGYKEVKKDLIIKLPKYSLFELENGRKRMLASAGELQKGNELALPSKYVNFLYLASHYEKLKGSPEDNEQKQLFVEQHKHYLDEIIEQISEFSKRVILADANLDKVLSAYNKHRDKPIREQAENIIHLFTLTNLGAPAAFKYFDTTIDRKRYTSTKEVLDATLIHQSITGLYETRIDLSQLGGD",
  "references": [],
  "features": [
    {
      "type": "CDS",
      "start": 0,
      "end": 1368,
      "strand": 1,
      "qualifiers": {
        "label": [
          "cas9"
        ],
        "synonym": [
          "SpCas9",
          "Cas9",
          "SpyCas9",
          "csn1"
        ],
        "db_xref": [
          "UniProt:Q99ZW2"
        ]
      }
    }
  ],
  "provenance": {
    "migrated_from": "genbank",
    "protein_features": "deferred to UniProt/InterPro/AlphaFold (see source_accession)"
  },
  "functional_claims": [],
  "uniprot_features": [
    {
      "type": "protein_domain",
      "start": 769,
      "end": 921,
      "label": "HNH Cas9-type",
      "so_term": "SO:0000417",
      "description": "HNH Cas9-type",
      "uniprot_type": "Domain"
    },
    {
      "type": "protein_domain",
      "start": 1332,
      "end": 1335,
      "label": "Motif: PAM substrate-binding",
      "so_term": "SO:0000417",
      "description": "PAM substrate-binding",
      "uniprot_type": "Motif"
    },
    {
      "type": "misc_feature",
      "start": 9,
      "end": 10,
      "label": "Active site: For RuvC-like nuclease domain",
      "so_term": "SO:0000110",
      "description": "For RuvC-like nuclease domain",
      "uniprot_type": "Active site"
    },
    {
      "type": "misc_feature",
      "start": 839,
      "end": 840,
      "label": "Active site: Proton acceptor for HNH nuclease domain",
      "so_term": "SO:0000110",
      "description": "Proton acceptor for HNH nuclease domain",
      "uniprot_type": "Active site"
    },
    {
      "type": "binding",
      "start": 9,
      "end": 10,
      "label": "Binding site",
      "so_term": "SO:0000409",
      "description": "",
      "uniprot_type": "Binding site"
    },
    {
      "type": "binding",
      "start": 9,
      "end": 10,
      "label": "Binding site",
      "so_term": "SO:0000409",
      "description": "",
      "uniprot_type": "Binding site"
    },
    {
      "type": "binding",
      "start": 761,
      "end": 762,
      "label": "Binding site",
      "so_term": "SO:0000409",
      "description": "",
      "uniprot_type": "Binding site"
    },
    {
      "type": "binding",
      "start": 765,
      "end": 766,
      "label": "Binding site",
      "so_term": "SO:0000409",
      "description": "",
      "uniprot_type": "Binding site"
    },
    {
      "type": "binding",
      "start": 765,
      "end": 766,
      "label": "Binding site",
      "so_term": "SO:0000409",
      "description": "",
      "uniprot_type": "Binding site"
    },
    {
      "type": "binding",
      "start": 982,
      "end": 983,
      "label": "Binding site",
      "so_term": "SO:0000409",
      "description": "",
      "uniprot_type": "Binding site"
    },
    {
      "type": "binding",
      "start": 1296,
      "end": 1297,
      "label": "Binding site",
      "so_term": "SO:0000409",
      "description": "",
      "uniprot_type": "Binding site"
    },
    {
      "type": "binding",
      "start": 1327,
      "end": 1328,
      "label": "Binding site",
      "so_term": "SO:0000409",
      "description": "",
      "uniprot_type": "Binding site"
    }
  ],
  "uniprot_import": {
    "fetched": "2026-10-01",
    "accession": "UniProt:Q99ZW2",
    "status": "match",
    "identity": 1.0,
    "sequence_match": true,
    "uniprot_entry_version": 148
  }
}
