{
  "schema_version": "1.0",
  "slug": "PSV40",
  "locus": "PSV40",
  "id": "PSV40",
  "description": "PSV40",
  "molecule_type": "DNA",
  "locus_annotations": {
    "data_file_division": "UNK",
    "date": "01-JAN-1980"
  },
  "sequence": "GTGTGTCAGTTAGGGTGTGGAAAGTCCCCAGGCTCCCCAGCAGGCAGAAGTATGCAAAGCATGCATCTCAATTAGTCAGCAACCAGGTGTGGAAAGTCCCCAGGCTCCCCAGCAGGCAGAAGTATGCAAAGCATGCATCTCAATTAGTCAGCAACCATAGTCCCGCCCCTAACTCCGCCCATCCCGCCCCTAACTCCGCCCAGTTCCGCCCATTCTCCGCCCCATGGCTGACTAATTTTTTTTATTTATGCAGAGGCCGAGGCCGCCTCGGCCTCTGAGCTATTCCAGAAGTAGTGAGGAGGCTTTTTTGGAGGCCTAGGCTTTTGCAAA",
  "references": [],
  "features": [
    {
      "type": "promoter",
      "start": 0,
      "end": 330,
      "strand": 1,
      "qualifiers": {
        "label": [
          "PSV40"
        ],
        "synonym": [
          "PSV40",
          "SV40 promoter"
        ]
      }
    }
  ],
  "provenance": {
    "migrated_from": "genbank"
  },
  "functional_claims": []
}
