{
  "schema_version": "1.0",
  "slug": "L3S2P11",
  "locus": "L3S2P11",
  "id": "L3S2P11",
  "description": "L3S2P11",
  "molecule_type": "DNA",
  "locus_annotations": {
    "data_file_division": "UNK",
    "date": "01-JAN-1980"
  },
  "sequence": "ATCGCTACCAAATTCCAGAAAACAGACGCTTTCGAGCGTCTTTTTTCGTTTTGGTCA",
  "references": [],
  "features": [
    {
      "type": "terminator",
      "start": 0,
      "end": 57,
      "strand": 1,
      "qualifiers": {
        "label": [
          "L3S2P11"
        ],
        "synonym": [
          "L3S2P11",
          "(modified) RF L3S2P11 terminator"
        ]
      }
    }
  ],
  "provenance": {
    "migrated_from": "genbank"
  },
  "functional_claims": []
}
