{
  "schema_version": "1.0",
  "slug": "HIS3",
  "locus": "HIS3",
  "id": "HIS3",
  "description": "HIS3",
  "molecule_type": "protein",
  "locus_annotations": {
    "data_file_division": "UNK",
    "date": "01-JAN-1980"
  },
  "sequence": "MTEQKALVKRITNETKIQIAISLKGGPLAIEHSIFPEKEAEAVAEQATQSQVINVHTGIGFLDHMIHALAKHSGWSLIVECIGDLHIDDHHTTEDCGIALGQAFKEALGAVRGVKRFGSGFAPLDEALSRAVVDLSNRPYAVVELGLQREKVGDLSCEMIPHFLESFAEASRITLHVDCLRGKNDHHRSESAFKALAVAIREATSPNGTNDVPSTKGVLM",
  "references": [],
  "features": [
    {
      "type": "CDS",
      "start": 0,
      "end": 220,
      "strand": 1,
      "qualifiers": {
        "label": [
          "HIS3"
        ],
        "synonym": [
          "His3",
          "imidazoleglycerol-phosphate dehydratase",
          "IGPD"
        ],
        "db_xref": [
          "UniProt:P06633"
        ]
      }
    }
  ],
  "provenance": {
    "migrated_from": "genbank"
  },
  "functional_claims": [],
  "uniprot_features": [
    {
      "type": "binding",
      "start": 13,
      "end": 14,
      "label": "Binding site",
      "so_term": "SO:0000409",
      "description": "",
      "uniprot_type": "Binding site"
    },
    {
      "type": "binding",
      "start": 63,
      "end": 72,
      "label": "Binding site",
      "so_term": "SO:0000409",
      "description": "",
      "uniprot_type": "Binding site"
    },
    {
      "type": "binding",
      "start": 63,
      "end": 64,
      "label": "Binding site",
      "so_term": "SO:0000409",
      "description": "",
      "uniprot_type": "Binding site"
    },
    {
      "type": "binding",
      "start": 89,
      "end": 94,
      "label": "Binding site",
      "so_term": "SO:0000409",
      "description": "",
      "uniprot_type": "Binding site"
    },
    {
      "type": "binding",
      "start": 89,
      "end": 90,
      "label": "Binding site",
      "so_term": "SO:0000409",
      "description": "",
      "uniprot_type": "Binding site"
    },
    {
      "type": "binding",
      "start": 90,
      "end": 91,
      "label": "Binding site",
      "so_term": "SO:0000409",
      "description": "",
      "uniprot_type": "Binding site"
    },
    {
      "type": "binding",
      "start": 93,
      "end": 94,
      "label": "Binding site",
      "so_term": "SO:0000409",
      "description": "",
      "uniprot_type": "Binding site"
    },
    {
      "type": "binding",
      "start": 115,
      "end": 116,
      "label": "Binding site",
      "so_term": "SO:0000409",
      "description": "",
      "uniprot_type": "Binding site"
    },
    {
      "type": "binding",
      "start": 137,
      "end": 138,
      "label": "Binding site",
      "so_term": "SO:0000409",
      "description": "",
      "uniprot_type": "Binding site"
    },
    {
      "type": "binding",
      "start": 161,
      "end": 162,
      "label": "Binding site",
      "so_term": "SO:0000409",
      "description": "",
      "uniprot_type": "Binding site"
    },
    {
      "type": "binding",
      "start": 185,
      "end": 194,
      "label": "Binding site",
      "so_term": "SO:0000409",
      "description": "",
      "uniprot_type": "Binding site"
    },
    {
      "type": "binding",
      "start": 185,
      "end": 186,
      "label": "Binding site",
      "so_term": "SO:0000409",
      "description": "",
      "uniprot_type": "Binding site"
    },
    {
      "type": "binding",
      "start": 186,
      "end": 187,
      "label": "Binding site",
      "so_term": "SO:0000409",
      "description": "",
      "uniprot_type": "Binding site"
    },
    {
      "type": "binding",
      "start": 189,
      "end": 190,
      "label": "Binding site",
      "so_term": "SO:0000409",
      "description": "",
      "uniprot_type": "Binding site"
    },
    {
      "type": "binding",
      "start": 213,
      "end": 216,
      "label": "Binding site",
      "so_term": "SO:0000409",
      "description": "",
      "uniprot_type": "Binding site"
    }
  ],
  "uniprot_import": {
    "fetched": "2026-10-01",
    "accession": "UniProt:P06633",
    "status": "match",
    "identity": 1.0,
    "sequence_match": true,
    "uniprot_entry_version": 187
  }
}
