{
  "schema_version": "1.0",
  "slug": "T7Te",
  "locus": "T7Te",
  "id": "T7Te",
  "description": "T7Te",
  "molecule_type": "DNA",
  "locus_annotations": {
    "data_file_division": "UNK",
    "date": "01-JAN-1980"
  },
  "sequence": "TCACACTGGCTCACCTTCGGGTGGGCCTTTCTGCGTTTAT",
  "references": [],
  "features": [
    {
      "type": "terminator",
      "start": 0,
      "end": 40,
      "strand": 1,
      "qualifiers": {
        "label": [
          "T7Te"
        ],
        "synonym": [
          "T7Te",
          "T7Te Terminator"
        ]
      }
    }
  ],
  "provenance": {
    "migrated_from": "genbank"
  },
  "functional_claims": []
}
